perempuan tolak ruu tni hal sebut rugi perempuan baik lalu tindak keras hingga leceh ajar informasi	train
ruu tni bahas cara tutup abai partisipasi masyarakat khianat konstitusi karena masyarakat hak tolak ruu tni ylbhi tegas tolak revisi tni ikut catat	train
bagai masyarakat sipil tolak tegas kesah ruu tni proses cara tutup sama sama laku sahur depan dpr bagai bentuk tolak sebut	train
waspada hadap strategi playing victim rezim klaim junjung tinggi pancasila tahan nkri padahal fakta dukung proyek obor china lalu ruu tni polri jaksa ruu komisi berantas korupsi justru alat kuasa meski tentang masyarakat sejak era rezim mulyono	train
revisi ruu tni tni milik satu fungsi tahan daulat negara libat administrasi sipil	train
izin teman telah susun peta mekanisme ruu tni rekan jawat lebih familiar paham soal	train
sidang paripurna kesah ruu tni mulai	train
revisi ruu tni tegas tni libat politik hanya akan fokus tugas jaga aman nasional	train
ruu tni baru tegas tni fokus tugas tahan negara milik dwifungsi perintah	train
henti tindak sweeping anggota tni hadap mahasiswa gelar demonstrasi alumni paham konteks cara rasional pihak asing memang perlu sumber daya alam oleh itu ruu tni perlu kuat geopolitik tahan aman nkri pecah belah jangan mudah provokasi	train
hormat dewan wakil rakyat republik indonesia apabila hari ruu tni sah dwifungsi nyata selamat bagai rakyat kira negara ratifikasi statuta roma	train
rui akan senantiasa cela dalam hati	train
wakil perintah tampak puas kesah undang undang tni konsentrasi pacu kesah ruu jaksa polri rasa puas rusak negeri ini	train
ruu tni ancam dunia literasi	train
detik detik rapat ruu tni selenggara cara tutup buah hotel dobrak koalisi masyarakat sipil rapat harus tutup selenggara hotel	train
anggar besar meski seluruh program penting akan jelas bagaimana beberapa program sebut rancang	train
revisi ruu tni tentara nasional indonesia fungsi semata mata bagai jaga tahan negara dari birokrasi sipil	train
ruu tni rupa jalan tuju otoritarianisme langsung perlahan pasti maaf semua	train
perhati video rilis menteri utama stalin bagai wujud komitmen hadap bijak bahasa	train
revisi ruu tni tentara nasional indonesia peran bagai kuat tahan negara jalan dwifungsi perintah	train
ruu tni baru kuat peran tni bagai jaga daulat negara campur urus perintah politik	train
meski kait langsung galak tagar lebih karena ini penting langsung hidup sila tulis tagar sebut kolom komentar	train
ikut adalah rangkum singkat alas rancang undang undang tentara nasional indonesia ruu tni baik tolak	train
beberapa pihak paham alas tolak hadap ruu tni saat hampir sah ikut jelas cara analogi ala pop moga jelas dapat paham	train
revisi ruu tni bawa indonesia arah lebih baik pisah peran tni urus politik lebih profesional	train
pakar hukum tata negara nyata kesah ruu tni rupa mundur demokrasi serius	train
dukung ruu tni terap dwifungsi abri prajurit tni duduk jabat sipil semua anggota tni baik kecuali kasus kasus tindas tewas lima tiga insiden akhir rupa tindak oknum semata dukung ruu tni karena suatu keluarga perlu lindung sebut	train
pergi ruu tni masyarakat sipil sukabumi kutuk keras perintah telah kesah ruu tni nilai sebut cedera amanat reformasi karena seluruh masyarakat sipil sukabumi laku aksi hari senin maret	train
ruu tni bukan sekadar revisi ancam hadap prinsip supremasi sipil apabila sah ruu akan buka peluang militer peran luar fungsi tahan cipta preseden bahaya demokrasi tata kelola negara reformasi ajar penting jaga supremasi sipil atas militer	train
ruu tni rancang atur beri ruang lebih luas anggota tni aktif peran perintah padahal sejak reformasi libat militer perintah batas tahan demokrasi ruu sah batas sebut kembali longgar	train
tolak kesah ruu tni baru baru namun makin tolak ruu polri meski revisi lembaga sebut sikap olah olah kuasa mutlak apabila wenang luas ini negara benar benar dalam kondisi sulit	train
ruu tni sah kini ruu polri ruu jaksa aju astaghfirullah perintah sikap olah olah musuh rakyat	train
premis ruu tni sah rakyat derita premis ruu tni sah simpul rakyat derita	train
kerja baik sayang	train
baru baru perintah tamil nadu ubah simbol resmi mata uang anggar negara tahun adopsi aksara tamil baru ganti simbol rupee india putus ambil rangka promosi bahasa tamil kuat identitas budaya negara sebut	train
gemar atiny telah bina captain hongjoong cerdas kini tunjuk mampu sebut ruu tni dampak jangka panjang hidup ayo suara tolak ruu tni	train
bahasa bayi muncul bagai konsekuensi sah ruu tni	train
bayang hari ruu tni sah rakyat sedang demonstrasi fufufafa bahkan keliling kampus resmi fakultas mohon bantu sebar informasi sebab belum temu lapor kait	train
jangan pernah serah bagai warga negara indonesia tegas tolak revisi undang undang tentara nasional indonesia ruu tni	train
hari kamis hari kelam mati supremasi sipil demokrasi indonesia dpr kesah ruu tni pagi kamis maret	train
umum mata uang baru perdana menteri nilai mata uang tamil nadu sebut lampau dolar investor internasional alih tabung baru investor rupee india antusias beli baru tamil nadu presiden amerika serikat donald trump nyata bangga atas hasil model dravida	val
panggil darurat rancang undang undang tni hendak sah cara diam diam desak dewan wakil rakyat segera tolak ruu tni penuh media sosial tagar seluruh platform pantau ikut rangkai aksi protes	val
banyak kasus tni masuk polri kerap tindak bagai lindung penting korporasi kondisi akan makin buruk apabila rancang undang undang tni sah panitia kerja ruu tni tuju luas jabat sipil dapat isi militer karena ruu tni dwifungsi abri tolak	val
tolak ruu tni hubung polemik tengah langsung tolak luas wewenang tni khusus ranah siber	val
pergi ruu tni masyarakat sipil sukabumi kecam keras kesah ruu tni perintah telah cedera amanat reformasi itu seluruh masyarakat sipil sukabumi gelar aksi hari senin maret titik akan umum kemudian	val
ingin memberitahukan milik salur telegram tolak sebar informasi kena tolak ruu tni ajak semua pihak boikot salur sebut informasi lanjut oleh lalu akun telegram	test
tni kini lagi libat sektor sipil maupun politik sesuai revisi ruu tni menitikberatkan tugas tahan ini prinsip supremasi sipil tetap jaga	test
rancang undang undang tni milik manfaat maupun urgensi jelas cepat sah karena ruu tni tolak	test
prihatin ruu hapus keras seksual penting perlu waktu lama sah sedang ruu tni langsung tuju prosedur transparan ini cermin sikap misoginis patriark negara	test
gencar tagar hari serta doa sama turun jalan dukung juang lalu media sosial hari adalah sempat akhir semua	test
